id,word,translation,definition,partOfSpeech,frequency,examples,pronunciation,context
cmfysoryy002hipxclan8fmp5,expeditaое,who insert,Peior crux colo accommodo benevolentia cohors creptio tristis tui vis.,verb,765,"[""Utor advenio libero victoria caste."",""Textus culpo vir contigo vos comburo adversus charisma.""]",modulo,Labore vos tantillus approbo vicinus deorsum bibo possimus amoveo synagoga.
cmfysos0k002iipxckuw9zzy4,cultellusить,till,Correptius beatae inflammatio comedo thorax suspendo cubicularis ulterius approbo pecus.,noun,719,"[""Cogo traho compono utrimque sumptus nam tollo crinis conventus."",""Audio tantum cultellus.""]",yieldingly,Cribro accommodo decipio.
cmfysos26002jipxcaixy0e4c,agoать,outrun or,Curo ustulo chirographum vis sapiente subnecto.,verb,754,"[""Sed ver quisquam coruscus vehemens repellat consequatur."",""Audentia artificiose libero venustas aggredior beatus cito vulgivagus aqua aegre.""]",knowingly,Vitae corrigo volva statim alias beneficium vilitas truculenter aliquam calcar.
cmfysos3q002kipxcf6onadrk,sociusая,section sizzle yahoo,Terminatio vito censura adipiscor vinco.,adverb,837,"[""Vesper sperno defluo tamisium libero decor."",""Verto tenus facere teneo articulus amplexus vix.""]",sarong,Curo iure agnitio.
cmfysos5d002lipxcq6kcl9r8,tenaxый,meh,Coniuratio aeger defungo barba cognomen.,noun,283,"[""Amplus accusantium non voluptatum."",""Approbo comptus quasi supplanto vulgaris cultura subiungo.""]",below,Aiunt vulgaris spiculum excepturi thesis praesentium excepturi vita subito cunctatio.
cmfysos6u002mipxciv7cbofm,tumить,opposite,Deorsum vulticulus cultellus.,noun,851,"[""Patior delicate coniecto degenero tamen."",""Aveho venio non conspergo angulus tremo quidem.""]",instructive,Spargo amor tamisium depopulo nobis tergum.
cmfysos8c002nipxclhga528h,thymumый,deck,Antea cornu velut appello vulgo trepide acerbitas.,verb,303,"[""Nihil capillus vulariter votum aestas stillicidium."",""Toties vacuus vergo vilitas arca similique ago voluptates.""]",within,Thema canonicus tripudio subvenio alter fuga subnecto adaugeo odit.
cmfysos9w002oipxc9jl5t48z,vitoая,besides athwart though,Collum sublime tempora aduro adnuo acsi non sunt necessitatibus.,noun,475,"[""Odio voco speculum."",""Bene desino assumenda adinventitias statua.""]",adjourn,Desolo defluo dicta arceo desipio.
cmfysosbh002pipxc4wmr9rhq,nostrumить,birdbath self-assured coexist,Adinventitias curiositas adstringo tergum.,noun,877,"[""Tolero doloribus textilis curto comburo alias amo."",""Laborum deporto agnitio delicate cultellus copiose.""]",publicity,Tubineus beneficium arma.
cmfysosd0002qipxcyqvd4zs1,sursumать,incidentally yum gadzooks,Creo umerus inflammatio.,verb,1000,"[""Aveho aranea acquiro."",""Deporto agnitio abutor volutabrum arma tricesimus cribro congregatio cupiditas degusto.""]",internalise,Tunc vere ustilo urbs expedita apud.
cmfysosei002ripxcc23t862g,audaciaое,plagiarise rebuff,Tepidus contabesco thorax ater.,adjective,711,"[""Xiphias ademptio tepidus averto demergo stultus architecto utilis."",""Tutis aggredior succedo cornu ager virtus.""]",per,Acerbitas vix deleo repellendus valeo alveus barba facilis apostolus volo.